{
  "schema": "pipeline.audio_intent.v1",
  "mode": "native_platform_audio",
  "required": true,
  "status": "recommended",
  "platform": "instagram",
  "surface": "regular_reel",
  "recommendations": [
    {
      "source": "campaign_factory.audio_catalog",
      "audio_title": "Runway Pop",
      "artist_name": "DJ A",
      "platform_audio_id": "ig_runway_pop",
      "platform_url": "https://instagram.com/audio/runway_pop",
      "vibe_tags": ["glam", "fit_check"],
      "freshness": "rising",
      "confidence": 0.9,
      "rationale": "trend:rising, tag_match:fit_check, native_locator",
      "instruction": "Attach native instagram audio: Runway Pop"
    }
  ],
  "operator_selection": {
    "audio_title": null,
    "artist_name": null,
    "platform_audio_id": null,
    "platform_url": null,
    "selected_at": null,
    "selected_by": null,
    "proof_url": null,
    "proof_type": null,
    "proof_note": null,
    "proof_captured_at": null,
    "notes": null
  },
  "task": {
    "schema": "pipeline.audio_task.v1",
    "status": "open",
    "assignee": null,
    "due_at": null,
    "proof_required": false,
    "created_at": null,
    "updated_at": null,
    "completed_at": null
  },
  "gates": {
    "allow_draft_export": true,
    "allow_preview_schedule": false,
    "allow_live_schedule": false,
    "allow_publish": false
  }
}
